{
  "schema": "wucios.profile.v1",
  "id": "noether-core",
  "display_name": "Noether Core",
  "status": "CANDIDATE_PROFILE",
  "role": "Invariant-preserving WuciOS base profile.",
  "default_profile": true,
  "authoritative_for_release": true,
  "allowed_component_classes": [
    "bootloader",
    "kernel",
    "init",
    "shell",
    "filesystem-tooling",
    "local-audit-tooling",
    "hashing-tooling",
    "signature-tooling",
    "manifest-tooling",
    "firewall-tooling",
    "daylight-tooling",
    "wuci-ji-tooling",
    "wuci-prism-tooling",
    "review-generation-tooling"
  ],
  "forbidden_component_classes": [
    "gui",
    "desktop-environment",
    "browser",
    "office-suite",
    "media-player",
    "game",
    "large-theme-pack",
    "wallpaper-pack",
    "default-network-service",
    "unjustified-suid",
    "unjustified-sgid",
    "runtime-compiler",
    "runtime-development-header",
    "social-media-material",
    "speculative-claim-material"
  ],
  "required_evidence_outputs": [
    "package-manifest.txt",
    "enabled-services.txt",
    "listening-ports.txt",
    "suid-sgid.txt",
    "kernel-modules.txt",
    "hash-manifest.sha256",
    "surface-report.json",
    "surface-report.md",
    "godel-boundary.md",
    "daylight-wucios-score.json",
    "review.json",
    "review.md"
  ],
  "invariants": [
    "GUI absent",
    "default network services absent",
    "listening ports absent unless explicitly allowed",
    "runtime compilers absent unless explicitly justified",
    "each included component has a component-register entry",
    "each current claim has evidence or is listed as a non-claim",
    "release score is invalid without artifact hash"
  ],
  "disqualifying_conditions": [
    "Xfce present",
    "browser present",
    "unapproved listening port present",
    "default SSH server enabled",
    "component without register entry",
    "score without artifact hash",
    "claim of external certification",
    "claim of perfect security",
    "claim of government approval"
  ],
  "notes": [
    "Noether Core is the serious WuciOS v2.4 release profile.",
    "Void Linux is not selected by this profile; substrate selection is governed by the Euclid Substrate Trial."
  ]
}
